{
  "name": "Transcription",
  "roomGuid": "a55fa6d3-08ee-4bcc-a5de-2f7b0311bd44",
  "roomserver": {
    "joinExisting": false,
    "uri": "localhost",
    "tcp": {
      "port": 8009
    },
    "wss": {
      "port": 8010,
      "cert": "./certs/cert.pem",
      "key": "./certs/key.pem"
    }
  },
  "status": {
    "port": 8011,
    "cert": "./certs/cert.pem",
    "key": "./certs/key.pem",
    "apikeys": []
  },
  "iceservers": [
    {
      "uri": "stun:stun.l.google.com:19302"
    }
  ],
  "configurationComplete": false
}