{
  "$schema": "../../config.schema.json",
  "name": "BaseApp",
  "roomGuid": "3cdcb02a-745f-41a9-ab79-da3b48d9434d",
  "roomserver": {
    "joinExisting": true,
    "uri": "localhost",
    "tcp": {
      "port": 8009
    },
    "wss": {
      "port": 8010,
      "cert": "./certs/cert.pem",
      "key": "./certs/key.pem"
    }
  },
  "status": {
    "port": 8011,
    "cert": "./certs/cert.pem",
    "key": "./certs/key.pem",
    "apikeys": []
  },
  "iceservers": [
    {
      "uri": "stun:stun.l.google.com:19302"
    }
  ],
  "configurationComplete": false
}